{
  "apiVersion": "refresh.drod.dev/v2",
  "kind": "AddonList",
  "cluster": "prod",
  "region": "us-east-1",
  "addons": [
    {
      "name": "coredns",
      "incomplete": true
    },
    {
      "name": "kube-proxy",
      "version": "v1.33.0-eksbuild.2",
      "status": "UPDATING",
      "health": "InProgress",
      "arn": "arn:aws:eks:us-east-1:123456789012:addon/prod/kube-proxy/fake",
      "issues": [],
      "createdAt": "2026-01-01T00:00:00Z",
      "modifiedAt": "2026-01-01T00:00:00Z"
    },
    {
      "name": "vpc-cni",
      "version": "v1.19.0-eksbuild.1",
      "status": "ACTIVE",
      "health": "Healthy",
      "arn": "arn:aws:eks:us-east-1:123456789012:addon/prod/vpc-cni/fake",
      "serviceAccountRoleArn": "arn:aws:iam::123456789012:role/vpc-cni",
      "configuration": "env:\n  ENABLE_PREFIX_DELEGATION: \"true\"\n  WARM_PREFIX_TARGET: \"1\"\n",
      "issues": [],
      "createdAt": "2026-01-01T00:00:00Z",
      "modifiedAt": "2026-01-01T00:00:00Z"
    }
  ],
  "failures": [
    {
      "kind": "Addon",
      "name": "coredns",
      "cluster": "prod",
      "region": "us-east-1",
      "operation": "eks:DescribeAddon",
      "reason": "Throttled",
      "retryable": true,
      "error": "ThrottlingException: Rate exceeded",
      "awsErrorCode": "ThrottlingException"
    }
  ]
}
